{
  "$schema": "https://json-schema.org/draft/2020-12/schema",
  "$id": "https://survivalgarden/contracts/batch.schema.json",
  "title": "Batch",
  "type": "object",
  "additionalProperties": false,
  "required": [
    "batchId",
    "startedAt",
    "currentStage",
    "stageEvents",
    "bedAssignments"
  ],
  "anyOf": [
    {
      "required": ["cultivarId"],
      "properties": {
        "cultivarId": {}
      }
    },
    {
      "required": ["cropId"],
      "properties": {
        "cropId": {}
      }
    }
  ],
  "properties": {
    "id": {
      "$ref": "#/$defs/id",
      "description": "Migration/compatibility alias for batchId."
    },
    "batchId": {
      "$ref": "#/$defs/id"
    },
    "cultivarId": {
      "$ref": "#/$defs/id",
      "description": "Canonical reference to the cultivar record represented by this batch."
    },
    "cropId": {
      "$ref": "#/$defs/id",
      "description": "Legacy migration/compatibility alias for cultivarId."
    },
    "cropTypeId": {
      "$ref": "#/$defs/id",
      "description": "Optional denormalized crop type reference resolved from the selected cultivar."
    },
    "variety": {
      "type": "string",
      "minLength": 1,
      "maxLength": 120
    },
    "startedAt": {
      "$ref": "#/$defs/isoDate",
      "description": "Batch start anchor field; backend domain/application code owns timeline consistency rules."
    },
    "propagationType": {
      "$ref": "#/$defs/propagationType"
    },
    "lifecycleStatus": {
      "type": "string",
      "enum": [
        "active",
        "harvested",
        "failed",
        "abandoned",
        "completed"
      ]
    },
    "startMethod": {
      "type": "string",
      "minLength": 1,
      "maxLength": 80,
      "description": "Optional batch-level start method metadata; backend/export code owns any timeline propagation."
    },
    "startLocation": {
      "type": "string",
      "minLength": 1,
      "maxLength": 120,
      "description": "Optional batch-level start location metadata; backend/export code owns any timeline propagation."
    },
    "startQuantity": {
      "$ref": "#/$defs/startQuantity"
    },
    "seedCountPlanned": {
      "type": "integer",
      "minimum": 0
    },
    "seedCountGerminated": {
      "type": "integer",
      "minimum": 0
    },
    "plantCountAlive": {
      "type": "integer",
      "minimum": 0
    },
    "stage": {
      "type": "string",
      "minLength": 1,
      "maxLength": 80,
      "description": "Legacy migration/compatibility input alias for currentStage."
    },
    "currentStage": {
      "type": "string",
      "minLength": 1,
      "maxLength": 80,
      "description": "Current stage field in the contract shape; backend domain/application code owns derivation rules."
    },
    "stageEvents": {
      "type": "array",
      "minItems": 1,
      "description": "Timeline event array in the contract shape; backend domain/application code owns timeline invariants.",
      "items": {
        "$ref": "#/$defs/stageEvent"
      }
    },
    "bedAssignments": {
      "type": "array",
      "items": {
        "$ref": "#/$defs/bedAssignment"
      }
    },
    "assignments": {
      "type": "array",
      "items": {
        "$ref": "#/$defs/bedAssignment"
      },
      "description": "Legacy migration/compatibility input alias for bedAssignments."
    },
    "notes": {
      "type": "string",
      "maxLength": 2000
    },
    "photos": {
      "type": "array",
      "items": {
        "$ref": "#/$defs/photoMetadata"
      }
    },
    "meta": {
      "$ref": "#/$defs/metaWithConfidence"
    }
  },
  "$defs": {
    "confidence": {
      "type": "string",
      "enum": [
        "exact",
        "estimated",
        "unknown"
      ],
      "description": "Confidence annotation for a fact value. Use exact for source-backed values, estimated for inferred/approximate values, and unknown when confidence cannot be determined."
    },
    "metaWithConfidence": {
      "type": "object",
      "additionalProperties": true,
      "properties": {
        "confidence": {
          "$ref": "#/$defs/confidence"
        }
      }
    },
    "id": {
      "type": "string",
      "minLength": 1,
      "maxLength": 128
    },
    "isoDate": {
      "type": "string",
      "pattern": "^\\d{4}-\\d{2}-\\d{2}T\\d{2}:\\d{2}:\\d{2}(?:\\.\\d{3})?(?:Z|[+-]\\d{2}:\\d{2})$"
    },
    "propagationType": {
      "type": "string",
      "enum": [
        "seed",
        "seedling",
        "transplant",
        "clove",
        "cutting",
        "division",
        "tuber",
        "bulb",
        "runner",
        "slip",
        "graft",
        "other"
      ]
    },
    "startQuantity": {
      "type": "object",
      "additionalProperties": false,
      "required": [
        "count",
        "unit"
      ],
      "properties": {
        "count": {
          "type": "number",
          "minimum": 0
        },
        "unit": {
          "type": "string",
          "minLength": 1,
          "maxLength": 40
        }
      }
    },
    "stageEvent": {
      "type": "object",
      "additionalProperties": false,
      "required": [
        "stage",
        "occurredAt"
      ],
      "properties": {
        "type": {
          "type": "string",
          "minLength": 1,
          "maxLength": 80,
          "description": "Migration/compatibility alias for stage."
        },
        "stage": {
          "type": "string",
          "minLength": 1,
          "maxLength": 80
        },
        "date": {
          "$ref": "#/$defs/isoDate",
          "description": "Migration/compatibility alias for occurredAt."
        },
        "occurredAt": {
          "$ref": "#/$defs/isoDate"
        },
        "location": {
          "type": "string",
          "minLength": 1,
          "maxLength": 120
        },
        "method": {
          "type": "string",
          "minLength": 1,
          "maxLength": 80
        },
        "meta": {
          "$ref": "#/$defs/metaWithConfidence"
        }
      }
    },
    "bedAssignment": {
      "type": "object",
      "additionalProperties": false,
      "required": [
        "bedId",
        "assignedAt"
      ],
      "properties": {
        "bedId": {
          "$ref": "#/$defs/id"
        },
        "assignedAt": {
          "$ref": "#/$defs/isoDate"
        },
        "removedAt": {
          "$ref": "#/$defs/isoDate"
        },
        "meta": {
          "type": "object",
          "additionalProperties": true
        }
      }
    },
    "photoMetadata": {
      "type": "object",
      "additionalProperties": false,
      "required": [
        "id",
        "storageRef"
      ],
      "properties": {
        "id": {
          "$ref": "#/$defs/id"
        },
        "storageRef": {
          "type": "string",
          "minLength": 1,
          "maxLength": 256
        },
        "capturedAt": {
          "$ref": "#/$defs/isoDate"
        },
        "contentType": {
          "type": "string",
          "minLength": 1,
          "maxLength": 128
        },
        "filename": {
          "type": "string",
          "minLength": 1,
          "maxLength": 256
        },
        "caption": {
          "type": "string",
          "maxLength": 500
        },
        "meta": {
          "type": "object",
          "additionalProperties": true
        }
      }
    }
  }
}
