{
  "batchId": "batch_strawberry_runner_2026",
  "cropId": "crop_strawberry",
  "startedAt": "2026-06-10T10:30:00Z",
  "propagationType": "runner",
  "startQuantity": {
    "count": 6,
    "unit": "runner_plants"
  },
  "plantCountAlive": 6,
  "stage": "rooting",
  "currentStage": "rooting",
  "stageEvents": [
    {
      "stage": "rooting",
      "occurredAt": "2026-06-10T10:30:00Z",
      "method": "pinned runner"
    }
  ],
  "bedAssignments": [
    {
      "bedId": "bed_herb_patch",
      "assignedAt": "2026-06-20T09:00:00Z"
    }
  ],
  "assignments": [
    {
      "bedId": "bed_herb_patch",
      "assignedAt": "2026-06-20T09:00:00Z"
    }
  ]
}
